{
  "$schema": "../docs/zh_cn/schemas/recipe/fabricating_recipe.schema.json",
  "type": "machine_max:fabricating",
  "ingredients": [
    {
      "ingredient": {
        "item": "machine_max:structural_component_1"
      },
      "count": 12
    },
    {
      "ingredient": {
        "item": "machine_max:power_component_1"
      },
      "count": 4
    },
    {
      "ingredient": {
        "item": "machine_max:electronic_component_1"
      },
      "count": 4
    },
    {
      "ingredient": {
        "item": "machine_max:mechanic_component_1"
      },
      "count": 3
    }
  ],
  "result": {
    "id": "machine_max:part",
    "count": 1,
    "components": {
      "machine_max:part_type": "machine_max:senna_gtr_chassis"
    }
  },
  "time": 120
}

