{
  "type": "machine_max:fabricating",
  "ingredients": [
    {
      "ingredient": {
        "tag": "c:ingots/copper"
      },
      "count": 1
    },
    {
      "ingredient": {
        "tag": "c:ingots/iron"
      },
      "count": 1
    },
    {
      "ingredient": {
        "tag": "c:ingots/gold"
      },
      "count": 1
    },
    {
      "ingredient": {
        "item": "minecraft:gunpowder"
      },
      "count": 1
    }
  ],
  "result": {
    "id": "machine_max:part",
    "count": 1,
    "components": {
      "machine_max:part_type": "machine_max:ae86_chassis"
    }
  },
  "time": 60
}