{
  "$schema": "../docs/zh_cn/schemas/recipe/fabricating_recipe.schema.json",
  "type": "machine_max:fabricating",
  "ingredients": [
    {
      "ingredient": {
        "item": "machine_max:structural_component_1"
      },
      "count": 2
    },
    {
      "ingredient": {
        "item": "machine_max:mechanic_component_1"
      },
      "count": 1
    },
    {
      "ingredient": {
        "item": "minecraft:glass_pane"
      },
      "count": 1
    }
  ],
  "result": {
    "id": "machine_max:part",
    "count": 1,
    "components": {
      "machine_max:part_type": "machine_max:wine_fox_door"
    }
  },
  "time": 60
}

